{
  "$schema": "../schemas/approval-record.schema.json",
  "schema_version": 1,
  "decision_id": "APPROVAL-2026-08-31-PRODUCT-IDENTITY",
  "recorded_on": "2026-08-31",
  "authority": {
    "role": "human-product-owner",
    "identity": "Repository product owner, confirmed by interactive instruction"
  },
  "source": {
    "kind": "interactive-instruction",
    "statement": "com.xerahs.app is better; dont worry about uniqueness, this app will replace it anyway"
  },
  "decision": "approved",
  "scope": {
    "contract_version": "0.1.0",
    "packages": [
      "CORE-PLATFORM-001"
    ]
  },
  "effects": {
    "normative_contract": true,
    "implementation_authorized": true,
    "activation_authorized": false,
    "census_closed": false,
    "release_authorized": false
  },
  "remaining_gates": [
    "Avalonia XerahS replacement migration, backup, rollback, and recovery verification",
    "Windows, macOS, and Linux implementation and conformance evidence",
    "Signing, packaging, migration, and distribution review",
    "Requirement-to-conformance traceability and parity review"
  ]
}
