{
  "$schema": "../schemas/approval-record.schema.json",
  "schema_version": 1,
  "decision_id": "APPROVAL-2026-09-28-MOBILE-TARGETS",
  "recorded_on": "2026-09-28",
  "authority": {
    "role": "human-product-owner",
    "identity": "Repository product owner, confirmed by interactive instruction"
  },
  "source": {
    "kind": "interactive-instruction",
    "statement": "Does the English contract cover mobile apps for Android and iOS as well? If not, extend it please. Recorded as approval of contract 0.3.0: new MOBILE-PLATFORM-001 (native Android and iOS targets, per-capability mobile scope including the iOS degraded region-capture disposition), CORE-PLATFORM-001 0.5.0 (CORE-029 rewritten), and the ROOT-PLATFORMS-001 amendment adding Android and iOS as supported targets. All other packages carry forward unchanged from APPROVAL-2026-09-28-IMPLEMENTATION-READINESS."
  },
  "decision": "approved",
  "scope": {
    "contract_version": "0.3.0",
    "packages": [
      "FILENAME-GENERATION-001",
      "POST-CAPTURE-ACTIONS-001",
      "REGION-CAPTURE-001",
      "EDITOR-SESSION-001",
      "EDITOR-ANNOTATIONS-001",
      "EDITOR-EFFECTS-001",
      "EDITOR-CANVAS-001",
      "EDITOR-OUTPUT-ACTIONS-001",
      "EDITOR-SETTINGS-001",
      "EDITOR-UTILITIES-001",
      "SETTINGS-CATALOG-001",
      "WORKFLOW-CATALOG-001",
      "INTERFACE-CATALOG-001",
      "CORE-PLATFORM-001",
      "COMPATIBILITY-CATALOG-001",
      "MOBILE-PLATFORM-001"
    ]
  },
  "effects": {
    "normative_contract": true,
    "implementation_authorized": true,
    "activation_authorized": false,
    "census_closed": false,
    "release_authorized": false
  },
  "remaining_gates": [
    "Baseline census closure evidence and product-owner closure signature",
    "Windows, macOS, Linux, Android, and iOS implementation and conformance evidence",
    "Licensing review of iOS distribution under GPL v3 before any iOS release (MOB-018)",
    "Per-row mobile dispositions for WORKFLOW-CATALOG-001 before it activates on mobile",
    "Security and privacy review for capture, credentials, automation, extensions, and external publication",
    "Accessibility review for native desktop and mobile interaction surfaces",
    "Compatibility fixtures and runtime-observation evidence",
    "Requirement-to-conformance traceability and parity review"
  ]
}
